{
  "$ref": "#/definitions/projects",
  "definitions": {
    "projects": {
      "type": "object",
      "properties": {
        "title": {
          "type": "string"
        },
        "description": {
          "type": "string"
        },
        "date": {
          "type": "string"
        },
        "tech": {
          "type": "array",
          "items": {
            "type": "string"
          }
        },
        "url": {
          "type": "string",
          "format": "uri"
        },
        "category": {
          "type": "string",
          "enum": [
            "web",
            "mobile",
            "backend",
            "other"
          ]
        },
        "$schema": {
          "type": "string"
        }
      },
      "required": [
        "title",
        "description"
      ],
      "additionalProperties": false
    }
  },
  "$schema": "http://json-schema.org/draft-07/schema#"
}